<xs:schema attributeFormDefault="unqualified" elementFormDefault="qualified" xmlns:xs="http://www.w3.org/2001/XMLSchema">
    <xs:element name="class">
        <xs:complexType>
            <xs:sequence>
                <xs:element name="textbookslist">
                    <xs:complexType>
                        <xs:sequence>
                            <xs:element name="book" maxOccurs="unbounded" minOccurs="0">
                                <xs:complexType>
                                    <xs:sequence>
                                        <xs:element type="xs:string" name="tittle" />
                                        <xs:element name="author" maxOccurs="unbounded" minOccurs="0">
                                            <xs:complexType>
                                                <xs:sequence>
                                                    <xs:element type="xs:string" name="firstname" />
                                                    <xs:element type="xs:string" name="lastname" />
                                                </xs:sequence>
                                            </xs:complexType>
                                        </xs:element>
                                        <xs:element type="xs:string" name="publisher" />
                                        <xs:element type="xs:string" name="website" />
                                        <xs:element type="xs:short" name="publication" />
                                        <xs:element type="xs:string" name="ISBN" />
                                        <xs:element type="xs:byte" name="edition" />
                                        <xs:element type="xs:string" name="cover" />
                                    </xs:sequence>
                                </xs:complexType>
                            </xs:element>
                        </xs:sequence>
                    </xs:complexType>
                </xs:element>
            </xs:sequence>
        </xs:complexType>
    </xs:element>
</xs:schema>